id,type,recipe,title,most_similar,ratings,stars,image,ingredients,directions
49,certain,10452/peppermint-bars/,Peppermint Bars,"[35437, 56831, 62122, 32550, 56442, 62655, 76841, 4747, 8916, 14846]",47,3.8297872543335,https://images.media-allrecipes.com/userphotos/560x315/7485086.jpg,"['cooking spray', '1/4 cup white sugar', '3 1/2 tablespoons butter, softened', '1 egg', '1 tablespoon apricot jam', '6 tablespoons all-purpose flour', '1 tablespoon unsweetened cocoa powder', 'salt to taste']","['Preheat an air fryer to 320 degrees F (160 degrees C). Spray a small fluted tube pan with cooking spray.', 'Beat sugar and butter together in a bowl using an electric mixer until light and creamy. Add egg and jam; mix until combined. Sift in flour, cocoa powder, and salt; mix thoroughly. Pour batter into the prepared pan. Level the surface of the batter with the back of a spoon.', 'Place pan in the air fryer basket. Cook until a toothpick inserted into the center of the cake comes out cleanly, about 15 minutes.']"
50,uncertain,l-recipe/62552573/malted-milk-brownies/,Malted Milk Brownies,"[30361, 15828, 53874, 65006, 78084, 6450, 11067, 11553, 32037, 34248]",0,0,https://images.media-allrecipes.com/images/79590.png,"['1 - 1 oz square unsweetened chocolate', '1/2 cup shortening', '3/4 cup sugar', '1/2 t vanilla', '2 eggs', '1 cup sifted flour', '1/2 cup chocolate malted milk powder (Ovaltine)', '1/2 t baking powder', '1/2 t salt', '1/2 cup chopped walnuts (optional, of course)']","['Melt the chocolate. (If you use the 3T cocoa powder and 1T butter in place of the solid chocolate, I recommend using some of the butter from the recipe to melt with it to get it smoother for mixing). Cool.  Cream the butter, sugar and vanilla until fluffy.  Beat in the eggs.  Blend in the melted chocolate.  Sift the dry ingredients and stir into the creamed mixture.  Fold in the nuts. Spread in greased 8x8x2 pan.  Bake at 350 degree oven for 20-25 minutes.  Cool.  Frost with malt frosting.', 'Frosting:', ""Cream 2T butter with 1/4 cup chocolate malt powder and a dash of salt. Slowly beat in 1 cup sifted confectioner's sugar and enough milk to make a spreading consistency (about 1 1/2T).""]"
51,uncertain,l-recipe/62150425/peppermint-patties/,Peppermint Patties,"[6541, 16779, 31166, 42786, 40307, 35639, 68789, 14720, 16569, 41951]",0,0,https://images.media-allrecipes.com/images/79590.png,"['2 cups  confectioners  sugar', '1 1/2 tablespoons  unsalted butter, softened', '1/4 teaspoon peppermint oil (do not use peppermint extract)', '1/4 teaspoon pure vanilla extract', '2 tablespoons  evaporated milk', 'Chocolate Coating:', '9 ounces semi sweet or bittersweet chocolate, coarsely chopped', '1 tablespoon shortening']","['Peppermint Patties: Line a cookie sheet with aluminum foil, smoothing out any wrinkles. Lightly dust the foil with confectioners sugar.', 'Beat (on low speed) the sugar, butter, peppermint oil, vanilla extract, and evaporated milk until combined. Increase the speed to medium-high and beat until very creamy (about 2-3 minutes). Transfer the batter to a bowl, cover with plastic wrap, and place in the refrigerator to chill until firm enough to roll into balls (about 30 - 60 minutes).', 'Roll the batter into 1 inch balls and place on the prepared pan. Flatten each ball with the palm of your hand until the patties are about 1 1/2 inches in diameter and 1/3 inch thick. Cover and place in the refrigerator until the patties are firm (about one hour).', 'Chocolate Coating: Melt the chocolate and shortening in a heatproof bowl placed over a saucepan of simmering water. Remove the patties from the refrigerator and dip, one patty at a time, into the melted chocolate, making sure both sides of each patty are completely coated with chocolate. (You can use 2 forks or a chocolate dipping fork.) Let any excess chocolate drip back into the bowl and then place the patties back on the foil. Once all the patties have been dipped in the chocolate, return to the refrigerator to chill until firm (30 - 60 minutes). Store in the refrigerator in an airtight container.']"
52,uncertain,220461/spotted-dog-irish-bread/,Spotted Dog Irish Bread,"[28694, 21879, 27910, 38012, 49065, 10998, 32153, 33722, 42854, 59432]",0,4.66666650772095,https://images.media-allrecipes.com/userphotos/560x315/807360.jpg,"['5 cups all-purpose flour', '1 1/2 cups white sugar', '2 2/3 tablespoons baking powder', '2 eggs', '2 cups milk', '2 cups raisins']","['Preheat the oven to 375 degrees F (190 degrees C).', 'Grease a 12-inch cast iron skillet.', 'Sift flour, sugar, and baking powder together in a large bowl.', 'Beat eggs with milk in a separate bowl.', 'Stir egg mixture into flour mixture until moistened; batter will be very thick.', 'Fold in raisins until thoroughly combined.', 'Spread batter into prepared cast iron skillet.', 'Bake in the preheated oven until bread has risen and is golden brown on top, about 1 hour.']"
53,uncertain,233263/shortbread-cookies-with-chocolate-and-almonds/,Shortbread Cookies with Chocolate and Almonds,"[57020, 5387, 17836, 54240, 4646, 2784, 33251, 56841, 12041, 27158]",0,5,https://images.media-allrecipes.com/userphotos/560x315/1992697.jpg,"['3 teaspoons olive oil, divided', '1/4 cup diced onion', '1 clove garlic, minced', '1/2 cup diced fresh mushrooms', '2 tablespoons chickpea crumbs (optional)', '1 tablespoon red wine, or to taste', '1/2 cup cooked brown rice', '1 teaspoon sesame oil', '3 dashes soy sauce, or to taste', '1 pinch dried oregano', '1 pinch ground thyme', '1 cup chopped fresh kale', 'salt and ground black pepper to taste', 'cooking spray', '1 egg, beaten', '1 teaspoon Sriracha sauce, or to taste']","['Heat oil in a skillet over medium-high heat. Add onion and garlic and saute until onion is translucent, about 5 minutes. Add mushrooms and chickpea crumbs and cook until mushrooms are soft, about 5 minutes. Pour in wine and cook for 1 minute. Add rice, sesame oil, and soy sauce and cook, stirring frequently, another 5 minutes. Add oregano and thyme and cook until fragrant, about 30 seconds. Toss in kale and cook until warmed and slightly wilted, about 1 minute. Season with salt and pepper.', 'Heat remaining 1 teaspoon olive oil in a small skillet over medium-high heat. Pour egg into the skillet; cook and stir until egg is set, about 5 minutes. Serve egg with kale and rice mixture and drizzle with Sriracha sauce.']"
54,uncertain,230399/peppermint-and-chocolate-brownies/,Peppermint and Chocolate Brownies,"[58810, 54900, 14307, 64665, 64962, 29775, 25008, 48840, 54779, 60465]",0,4,https://images.media-allrecipes.com/userphotos/560x315/974665.jpg,"['Cake:', '4 eggs, separated', '3 1/2 cups sifted cake flour', '1 tablespoon baking powder', '3/4 cup butter, room temperature', '2 cups white sugar', '1/2 teaspoon salt', '1 cup milk, room temperature', '1 teaspoon lemon juice', '1 teaspoon vanilla extract', 'Custard:', '2 cups white sugar, divided', '1/2 teaspoon salt', '1/4 cup all-purpose flour', '1/4 cup cornstarch', '1/4 cup unsweetened cocoa powder', '2 (1 ounce) squares bittersweet chocolate, chopped', '4 large eggs, beaten', '4 cups whole milk', '1 tablespoon butter, room temperature', '1 tablespoon vanilla extract', 'Buttercream Frosting:', '1 cup butter, softened', ""3 cups confectioners' sugar, sifted"", '1 cup unsweetened cocoa powder, sifted', '1 teaspoon vanilla extract', '1 tablespoon hot water (optional)', 'Ganache:', '2 cups semisweet chocolate chips', '2 cups heavy whipping cream', '2 teaspoons vanilla extract']","['Preheat oven to 375 degrees F (190 degrees C). Grease 3 9-inch cake pans.', 'Beat whites of 4 eggs in a glass or metal bowl until foamy. Continue to beat until stiff peaks form. Lift your beater or whisk straight up: the tip of the peak formed by the egg whites should curl over slightly. Set aside. Reserve egg yolks in a small bowl. Sift together cake flour and baking powder in a separate bowl.', 'Beat 3/4 cup butter, 2 cups sugar, and 1/2 teaspoon salt with an electric mixer in a large bowl until light and fluffy. The mixture should be noticeably lighter in color. Add reserved egg yolks one at a time, allowing each yolk to blend into the butter mixture before adding the next. Pour in cake flour mixture alternately with 1 cup milk, mixing until just incorporated. Stir lemon juice and 1 teaspoon vanilla extract into batter.', 'Whisk beaten egg whites a few times; use a whisk or rubber spatula to fold 1/3 of the egg white mixture into the batter to lighten it. Fold in remaining egg whites, mixing just until combined. Pour batter into prepared pans and spread evenly over bottom.', 'Bake in preheated oven until cake is light golden brown and just pulling from the sides of the pan, 15 to 20 minutes. Do not overbake. Cool in pans for 5 minutes, then invert onto cooling racks to cool completely.', 'To make custard: combine 1 1/2 cups sugar, 1/2 teaspoon salt, 1/4 cup flour, cornstarch, and 1/4 cup cocoa powder in a saucepan and mix well. In a separate bowl, whisk remaining 1/2 cup sugar into 4 beaten eggs. Pour 4 cups whole milk into saucepan and cook over medium heat, stirring constantly, until mixture begins to boil. Remove from heat and gradually pour hot milk mixture into egg mixture, whisking constantly. Add chopped chocolate and stir until chocolate melts.', 'Return custard to saucepan and cook, stirring constantly, over medium heat until mixture has thickened, about 5 minutes. Remove from heat; stir in 1 tablespoon butter and 1 tablespoon vanilla extract. Transfer custard to a bowl and allow to cool.', ""To make buttercream: place 1 cup softened butter in a mixing bowl. Gradually beat in 3 cups sifted confectioners' sugar. Beat in 1 cup sifted cocoa powder. Mix in 1 teaspoon vanilla extract to make a smooth frosting. If the frosting is too stiff, add a tablespoon of hot water or as needed, drizzling it very slowly, and mix well until desired consistency is reached."", 'To make ganache: place chocolate chips in a large mixing bowl. Heat heavy cream in a saucepan until very hot but not boiling. Remove from heat and pour over the chocolate chips. Let stand for 3 minutes, then whisk, scraping sides and bottom of the bowl, until smooth. Stir in 2 teaspoons vanilla extract. Allow to cool to room temperature, cover, and set aside. Ganache should be spreadable and not firm.', 'To assemble cake: using a long serrated knife and a gentle sawing motion, slice each cake layer in half horizontally. Cover cake plate with strips of parchment paper or foil for easier clean up. Put a dab of buttercream in the center of the plate to keep cake from shifting. Set a cake half on the plate.', 'Spread custard filling onto cake layer, taking care not to spread it too close to the edge (weight of the cake layers will cause it to spread out). Gently lay another cake round on top of the first and repeat with another custard layer. Repeat with remaining layers and custard, topping custard with the last cake layer. Chill cake for 30 minutes to allow it to firm up.', 'Frost top and sides of cake with chocolate buttercream. Chill for 30 minutes, to firm and set.', 'Spread frosted cake with ganache. Remove parchment strips or aluminum foil from cake plate. Store cake in the refrigerator.']"