id,type,recipe,title,most_similar,ratings,stars,image,ingredients,directions
0,main,220648/quick-and-easy-strawberry-shake-pie/,Quick and Easy Strawberry Shake Pie,"[1, 2, 3, 4, 5, 6, 7, 8, 9, 10]",5,4.66666650772095,https://images.media-allrecipes.com/userphotos/560x315/4499439.jpg,"['1 (8 ounce) package cream cheese, softened', '1/2 (14 ounce) can sweetened condensed milk', '3/4 cup mashed strawberries', '2 (8 ounce) containers frozen whipped topping, thawed, divided', '2 (9 inch) prepared graham cracker crusts', 'sliced fresh strawberries (optional)']","['Beat cream cheese and sweetened condensed milk with an electric mixer in a bowl until well combined.', 'Stir strawberries and 1 container whipped topping into cream cheese mixture.', 'Spread mixture into the two prepared pie crusts. Top pies with remaining container of whipped topping.', 'Garnish with sliced strawberries if desired. Chill for at least 2 hours.']"
1,certain,15400/caramel-pie/,Caramel Pie,"[]",71,4.53521108627319,https://images.media-allrecipes.com/userphotos/560x315/1731471.jpg,"['1 (14 ounce) can sweetened condensed milk', '1 (9 inch) prepared graham cracker crust', '1 (12 ounce) container frozen whipped topping, thawed']","['In a large pot, place the can of sweetened condensed milk with the label taken off, in the pot and cover with water. Cook on high until water comes to a boil, then turn on medium/high for 4 hours, only adding water to keep the can covered.', 'Carefully open can and pour into pie shell. Cool pie in refrigerator. When completely cooled, top with frozen whipped topping. Serve.']"
2,certain,l-recipe/56438096/chriss-quick-and-easy-lemon-pie/,Chris's Quick and Easy Lemon Pie,"[]",0,0,https://images.media-allrecipes.com/images/79590.png,"['1 (4.3 ounce) package non-instant lemon pudding mix', '1 (8 ounce) package cream cheese, softened', '1/2 (14 ounce) can sweetened condensed milk', '4 tablespoons lemon juice', '1 tbs lemon zest', '1 (9 inch) prepared graham cracker crust', '1 (8 ounce) container frozen whipped topping, thawed']","['Cook pudding as directed on package. After pudding thickens, turn down heat to low. Stir in cream cheese, condensed milk,lemon juice and lemon zest. Stir frequently as mixture may stick to saucepan.', 'Pour mixture into graham cracker crust. Cover and refrigerate at least 4 hours or overnight. When pie is ready, serve with whipped topping.']"
3,certain,276074/5-ingredient-no-bake-cheesecake/,5-Ingredient No-Bake Cheesecake,"[]",0,0,https://images.media-allrecipes.com/images/79591.png,"['2 1/2 pounds ground turkey', '1/2 cup chopped onion', '1/2 cup chopped green bell pepper', '1/2 cup chopped tomato', '1 cup no-salt-added ketchup', '7 tablespoons barbeque sauce', '2 tablespoons prepared yellow mustard', '1 tablespoon vinegar', '1/2 teaspoon celery seed', '1/2 teaspoon ground black pepper', '1/2 teaspoon red pepper flakes, or to taste', '8 hamburger bun, split and toasted']","['Heat a nonstick skillet over medium heat; cook and stir turkey, onion, bell pepper, and tomato until turkey is crumbly and no longer pink, about 5 minutes. Stir in ketchup, barbeque sauce, mustard, vinegar, celery seed, black pepper, and red pepper flakes. Reduce heat to low and simmer for 10 minutes, stirring occasionally. Serve turkey mixture on toasted hamburger buns.']"
4,certain,15964/lemon-icebox-pie-iii/,Lemon Icebox Pie III,"[]",432,4.5,https://images.media-allrecipes.com/userphotos/560x315/439002.jpg,"['3 quarts water', '1 1/2 cups medium-grain rice', '5 ounces white fish, cut into small chunks', '1 (3 inch) piece fresh ginger root, thinly sliced', '1 spring onion, sliced', '2 teaspoons chicken bouillon granules', '1/2 teaspoon ground black pepper', '3 tablespoons chopped fresh parsley', '1/2 teaspoon salt, or to taste']","['Combine water and rice in a large pot over high heat. Bring to a boil; simmer for 5 minutes. Reduce heat to medium-low and simmer until rice is tender, about 30 minutes.', 'Combine fish, ginger, spring onion, chicken bouillon granules, and pepper in a bowl. Let marinate for 15 minutes.', 'Stir fish mixture into the pot. Simmer gently until rice is very soft and fish is falling apart, about 20 minutes. Season with parsley and salt.']"
5,certain,8331/carrot-cake-with-butter-sauce/,Millionaire Pie,"[]",59,4.61016941070557,https://images.media-allrecipes.com/userphotos/560x315/7420218.jpg,"['1 (0.6 ounce) cake compressed fresh yeast', '1/4 cup warm water (110 degrees F/45 degrees C)', '1/2 cup white sugar', '1/2 cup butter', '1 egg, beaten', '1 teaspoon salt', '2 cups scalded milk', '6 cups all-purpose flour', '1 pinch ground ginger', '1 pinch ground mace', '1/4 teaspoon orange zest', '1/2 cup golden raisins', '1/2 cup candied mixed fruit peel', '1/2 cup blanched slivered almonds', '1 egg yolk', '1 tablespoon milk', ""2 tablespoons confectioners' sugar""]","['Dissolve yeast in warm water.', 'In a large bowl, cream sugar and butter. Add beaten egg and salt. Stir in cooled milk and then the yeast. Add 1 1/2 cups sifted flour; beat into a smooth batter. Cover and let rise until light, about one hour.', 'Stir spices and dried orange zest into the sponge. Add 4 1/2 cups of flour to make a soft dough. Place on a lightly floured board, and knead until smooth and elastic. Knead in raisins and candied peel. Put in a well oiled bowl, and turn once to coat the surface of the dough.  Cover. Set aside to rise until double in bulk, about 2 hours.', 'Divide dough into ten parts, roll into desired lengths, and let rise about 15 minutes.', 'On a heavily greased baking sheet, make a braid of three parts, beginning in the center and working braid loosely toward each end. Pinch ends together. Twist the remaining two pieces together, and place on the base of the braid. In a small bowl, beat together egg yolk and milk; brush the loaf with this mixture. Sprinkle sliced almonds over the loaf. Repeat process for second loaf. Let rise about 45 minutes.', ""Bake at 350 degrees F (175 degrees C) for 45 minutes. Transfer bread to a wire rack, and cool completely. Cover while cooling with a tea towel to make a soft crust. Sprinkle with confectioners' sugar.""]"
6,uncertain,l-recipe/64532971/lemon-yogurt-pie-with-graham-cracker-crust/,Lemon Yogurt Pie with Graham Cracker Crust,"[]",0,0,https://images.media-allrecipes.com/images/79590.png,"['1 pound fresh mushrooms, sliced', '1 large onion, chopped', '2 tablespoons butter or stick margarine', '1 1/2 pounds boneless skinless chicken breasts, cut into 2-inch strips', '1/4 cup browning sauce', '1 1/3 cups reduced-sodium beef broth, divided', '1 cup white wine or additional reduced-sodium beef broth', '2 tablespoons ketchup', '2 garlic cloves, minced', '1 teaspoon salt', '3 tablespoons all-purpose flour', '1 cup (8 ounces) fat-free sour cream', '6 cups cooked no-yolk noodles']","['In a large nonstick skillet, saute mushrooms and onion in butter until tender. Remove and set aside. In the same skillet, cook the chicken with browning sauce until browned. Add 1 cup broth, wine or additional broth, ketchup, garlic and salt. Bring to a boil. Reduce heat; cover and simmer for 15 minutes.', 'Combine flour and remaining 1/3 cup broth until smooth; stir into chicken mixture. Add reserved mushroom mixture. Bring to a boil; cook and stir for 2 minutes or until thickened. Reduce heat to low. Stir in sour cream; heat through (do not boil). Serve over noodles.']"
7,uncertain,239157/easy-apple-pie-coffee-cake/,Easy Apple Pie Coffee Cake,"[]",0,4.5,https://images.media-allrecipes.com/userphotos/560x315/1394295.jpg,"['3 cups shredded cabbage', '1 carrot, shredded', '1 onion, diced', '1 red bell pepper, diced', '1 jalapeno pepper, seeded and diced', '1 tablespoon chopped fresh cilantro', '1/2 cup canola oil', '2 tablespoons apple cider vinegar', '1 tablespoon white sugar', '1 teaspoon cayenne pepper', 'salt and pepper to taste']","['In a large bowl, toss together the cabbage, carrot, onion, red pepper, jalapeno and cilantro.  Set aside.', 'In a small bowl, whisk together the oil, vinegar, sugar, cayenne pepper, salt and pepper.  Pour over vegetable mixture and toss to combine.  Cover and refrigerate for at least one hour.']"
8,uncertain,l-recipe/63990284/best-ever-pie-crust/,Best Ever Pie Crust,"[]",0,5,https://images.media-allrecipes.com/images/79590.png,"['1 package (2-layer size) white cake mix', '1 cup boiling water', '1 (3 ounce) package JELL-O Brand Cranberry Flavor Gelatin', ""6 ounces BAKER'S White Chocolate, broken into pieces"", '1 (8 ounce) package PHILADELPHIA Cream Cheese, softened', '1/4 cup butter or margarine, softened', '1 teaspoon vanilla', '2 1/2 cups powdered sugar', '1/2 cup dried cranberries']","['Prepare cake batter and bake as directed on package for 24 cupcakes. Cool in pans 10 min. Pierce tops with fork.', 'Add boiling water to gelatin mix in small bowl; stir 2 min. until completely dissolved. Spoon over cupcakes. Refrigerate 30 min.', 'Melt chocolate as directed on package. Beat cream cheese and butter in large bowl with mixer until blended. Add chocolate and vanilla; mix well. Gradually add sugar, beating after each addition until light and fluffy.', 'Spread frosting onto cupcakes. Top with cranberries.']"
9,uncertain,12296/peanut-butter-pie-vi/,Peanut Butter Pie VI,"[]",0,3,https://images.media-allrecipes.com/userphotos/560x315/3204337.jpg,"['12 eggs', 'oil for deep frying', '4 tablespoons cornstarch, plus more as needed', 'bamboo skewer', 'Sauce:', '1/4 cup rice vinegar', '1/4 cup ketchup', '1/4 cup brown sugar', '2 teaspoons soy sauce', 'Batter:', '1 cup all-purpose flour', '1/2 cup water', 'salt and freshly ground black pepper to taste', 'red and yellow food coloring']","['Place eggs in a saucepan and cover with water. Bring to a boil, remove from heat, and let eggs stand in hot water for 15 minutes. Remove eggs from hot water, cool under cold running water, and peel.', 'Combine rice vinegar, ketchup, brown sugar, and soy sauce in a saucepan. Heat over medium heat while stirring until sugar has dissolved, about 5 minutes. Stir sauce and let cool.', 'Prepare the batter by adding a few drops of red and yellow food coloring to the water to get a deep orange color. Combine flour with salt and pepper in a bowl; pour in orange water and stir until there are no lumps.', 'Heat oil in a wok to 375 degrees F (190 degrees C).', 'Gently roll eggs in cornstarch to coat and shake off excess cornstarch. Dip into orange batter so they are fully covered. Poke eggs with the bamboo skewer and drop into the hot oil. Deep fry until the batter is crispy, about 2 minutes per side. Remove eggs with a slotted spoon and drain on paper towels.']"
10,uncertain,215288/topsy-turvy-apple-pie/,Topsy-Turvy Apple Pie,"[]",0,4.96000003814697,https://images.media-allrecipes.com/userphotos/250x250/984964.jpg,"['1/2 cup butter', '1 (14 ounce) can sweetened condensed milk', '1 (6 ounce) package butterscotch chips', '1 (12 ounce) package chocolate chips', '1 cup chopped pecans', '1 (10.5 ounce) package miniature marshmallows', '1 teaspoon vanilla extract']","['In a saucepan, combine butter and sweetened condensed milk. Bring to a boil, then remove from heat. Stir in chocolate chips and butterscotch chips until melted. Stir in nuts, marshmallows and vanilla. Drop by spoonfuls onto waxed paper.']"

11,main,19005/chocolate-chip-cookie-ice-cream-cake/,Chocolate Chip Cookie Ice Cream Cake,"[12, 13, 14, 15, 16, 17, 18, 19, 20, 21]",368,4.8070650100708,https://images.media-allrecipes.com/userphotos/560x315/450406.jpg,"['1 (18 ounce) package small chocolate chip cookies', '1/4 cup margarine, melted', '1 cup hot fudge topping', '2 quarts vanilla ice cream', '1 cup whipped cream', '12 cherries']","['Crush half the cookies (about 20) to make crumbs.  Combine crumbs with melted margarine and press into the bottom of a 9-inch springform pan or pie plate.  Stand remaining cookies around edge of pan.  Spread 3/4 cup fudge topping over crust.  Freeze 15 minutes.', 'Meanwhile, soften 1 quart of ice cream in microwave or on countertop.  After crust has chilled, spread softened ice cream over fudge layer.  Freeze 30 minutes.', 'Scoop remaining quart of ice cream into balls and arrange over spread ice cream layer.  Freeze until firm, 4 hours or overnight.  To serve, garnish with remainder of fudge topping, whipped cream and cherries.']"
12,certain,233132/amazing-grasshopper-pie/,Amazing Grasshopper Pie,"[]",0,4.5,https://images.media-allrecipes.com/userphotos/560x315/1020389.jpg,"['2-3 lbs. pork country style ribs cut into bite sized pieces', '1 jar Nopales drained and rinsed(cactus found in your mexican section of your grocery store)', '5 tomatillos cleaned, boiled', '2 jalepenos boiled', '1/2 small onion diced', '3 stems of cilantro chopped', 'salt and peper to taste']","['1.) Boil your pork ribs till cook through and tender. Then drain the water and brown.', '2.) Boil tomatillos and jalepenos togeather once cooked through till soft, liquiffy them in a blender till smooth adding in onion, salt and cilantro until soup constinace.', '3.) Add nopales to the browned ribsand sautee till heated through.', '4.) Add in your tomatillo and jalepeno mix bring to boil then reduce heat and simmer for 10-15 min.', 'Serve with yellow rice,refried beans and warmed corn tortillas.']"
13,certain,219024/best-mud-pie/,Best Mud Pie,"[]",21,4.57142877578735,https://images.media-allrecipes.com/userphotos/560x315/4536849.jpg,"['1 (6 ounce) chocolate sandwich cookie crumb crust (such as an OREO® crust)', '1 quart coffee ice cream', '1 (12 ounce) package miniature chocolate chips', '1 (12 ounce) jar hot fudge topping', '1/2 (18 ounce) package crushed chocolate sandwich cookies, divided', '1 (8 ounce) container frozen whipped topping, thawed', '3/4 cup chocolate syrup']","['Freeze the crust until firm, about 30 minutes. Place half the coffee ice cream into a bowl, and let it stand about 10 minutes to soften. Return remaining ice cream to the freezer. Mix softened ice cream with the mini chocolate chips. Spread the ice cream and chips in an even layer over the frozen crust. Cover with plastic wrap, and freeze for 2 hours.', 'Heat the topping in the microwave on low until warm and easy to pour, 30 seconds to 1 minute (do not let the sauce get very hot). Pour into a bowl. Set aside 2 tablespoons cookie crumbs for garnish; stir remaining cookie crumbs into the fudge topping. Remove the pie from the freezer, and layer the cookie crumbs and fudge topping mixture over the ice cream with chips. Cover with plastic wrap, and return to freezer for 2 hours.', 'Take the remaining frozen coffee ice cream out of the freezer, and allow to stand for about 10 minutes to soften. Layer the ice cream over the layer of cookie crumbs and fudge topping. Cover with plastic wrap, and return to freezer for 2 more hours.', 'Remove pie, and frost the top of the pie with the whipped topping. Top with the reserved cookie crumbs. Cover with plastic wrap, and return to freezer for 2 more hours to freeze the whipped topping layer. Cut the pie into serving pieces, and drizzle each serving with about 1 tablespoon of the chocolate syrup.']"
14,certain,76004/easy-ice-cream-cake/,Easy Ice Cream Cake,"[]",273,4.72893762588501,https://images.media-allrecipes.com/userphotos/250x250/658582.jpg,"['16 ice cream sandwiches', '1 (16 ounce) container frozen non-dairy whipped topping', '1 (12 ounce) jar chocolate fudge topping, room temperature', '1 (1.5 ounce) bar chocolate candy bar, grated']","['Place 8 of the ice cream sandwiches side by side in a 9x13 inch baking dish. Spread evenly with half of the hot fudge topping, then half of the whipped topping. Repeat with the remaining sandwiches and toppings. Sprinkle with grated chocolate bar.', 'Cover and freeze for at least 1 hour before serving. Keep unused portion covered and frozen.']"
15,certain,241894/black-forest-trifle/,Black Forest Trifle,"[]",0,5,https://images.media-allrecipes.com/userphotos/560x315/4795562.jpg,"['1 (12 ounce) package frozen pound cake, thawed and cut into cubes', '2 (21 ounce) cans cherry pie filling', '1 (12 ounce) jar hot fudge ice cream topping, warmed', '4 cups frozen whipped topping, thawed']","['Put about half of the pound cake cubes into the bottom of a glass trifle bowl; top with 1 can cherry pie filling, half of the hot fudge, and 2 cups whipped topping. Repeat layers.', 'Drizzle some of the hot fudge over the top layer of whipped topping. Dollop small amounts of the cherry pie filling decoratively over the whipped topping.', 'Cover bowl with plastic wrap and refrigerate at least 2 hours.']"
16,certain,110311/chocolate-wafer-ice-cream-sandwiches/,Chocolate Wafer Ice Cream Sandwiches,"[]",0,4.68421030044556,https://images.media-allrecipes.com/userphotos/560x315/43074.jpg,"['4 cups hot water', '3/4 cup sugar or 1/2 c. honey', '1 cup oil', '6 Tbsp. yeast', '3 eggs', '5 cups. flour', '1 Tbsp. salt']","['Stir together water sugar, oil, and yeast.', 'Add eggs, salt and flour.', 'Gradually add another 5-6 cups flour, kneading well after each addition.  When dough follows the hook around and no longer sicks to the side of the bowl or the middle column it is ready (approx 10 min.)', 'Immediately shape into whatever rolls or buns you want and place on greased pan.  Let rise for approx. 10 min.  Bake @425 deg. F for 10 min.']"
17,uncertain,254299/red-white-and-blue-ice-cream-pie/,"Red, White and Blue Ice Cream Pie","[]",0,3.66666674613953,https://images.media-allrecipes.com/userphotos/560x315/3686994.jpg,"['1 pound boneless pork chops, cut into stir-fry strips', '1 tablespoon hoisin sauce', '1 tablespoon cornstarch', '2 tablespoons hoisin sauce', '1/4 cup chicken broth', '1 tablespoon cornstarch', '1 tablespoon rice vinegar', '1 tablespoon white sugar', '1 teaspoon red pepper flakes, or to taste', '1 tablespoon sesame oil', '2 cloves garlic, minced', '2 teaspoons minced fresh ginger root', '1 carrot, peeled and sliced', '1 green bell pepper, sliced', '1 (4 ounce) can sliced water chestnuts, drained', '2 green onions, sliced']","['Mix the sliced pork, 1 tablespoon hoisin sauce, and 1 tablespoon cornstarch together in a bowl. Set aside. Combine the remaining 2 tablespoons hoisin sauce, chicken broth, and 1 tablespoon cornstarch with rice vinegar, sugar, and cayenne pepper in small bowl. Set aside.', 'Heat the sesame oil in a skillet over medium-high heat. Stir in the pork; cook and stir until the pork begins to brown, about 5 minutes. Add the garlic and ginger; cook and stir until fragrant. Mix in the carrot, bell pepper, and water chestnuts, cooking until the carrots are tender. Stir in the reserved hoisin sauce mixture and continue cooking and stirring until the flavors are combined, about 3 minutes.']"
18,uncertain,143484/coconut-ice-cream-balls/,Coconut Ice Cream Balls,"[]",0,5,https://images.media-allrecipes.com/userphotos/250x250/427622.jpg,"['16 Oz. can green beans (drained) or fresh cooked green beans', '1/2 cup sour cream', '1/3 cup salad dressing or mayo', '6 green onions (sliced)', '1 cucumber (sliced) salt and pepper', 'garlic salt', '1 Tb. dill weed']",['Combine.']
19,uncertain,l-recipe/64543011/4-ingredient-ice-cream/,4 Ingredient Ice Cream,"[]",0,0,https://images.media-allrecipes.com/images/79590.png,"['1 large onion, sliced into rings', '10 center-cut boneless pork chops, trimmed', '1 (10.75 ounce) can cream of onion soup', '1 (10.75 ounce) can cream of mushroom soup', '5 fluid ounces water', '1 (1 ounce) package ranch dressing mix', '1 (1 ounce) package dry onion soup mix', 'salt and ground black pepper to taste']","['Spread about half the onion slices into the bottom of the slow cooker. Arrange 5 pork chops atop the onion layer. Repeat layering with remaining onion and pork chops.', 'Pour cream of onion soup, cream of mushroom soup, and water over the pork chops and onion. Sprinkle ranch dressing mix and onion soup mix over the pork chops; season with salt and pepper.', 'Cook on High until the pork chops are tender to your liking, 2 1/2 to 3 hours. Alternately, you can cook on Low for 4 1/2 to 5 hours. An instant-read thermometer inserted into the center should read at least 145 degrees F (63 degrees C).']"
20,uncertain,246375/easy-brownie-and-peanut-butter-cup-ice-cream-cake/,Easy Brownie and Peanut Butter Cup Ice Cream Cake,"[]",0,0,https://images.media-allrecipes.com/images/79591.png,"['1 cup almonds', '1/2 cup sliced almonds', '1 cup cashews', '1/4 cup chopped pistachio nuts', '1/4 cup pepitas (pumpkin seeds)', '1 cup dried pitted dates, finely chopped', '1 cup shredded coconut', '1 teaspoon fleur de sel (sea salt flakes)', '1 teaspoon cinnamon', '1/4 teaspoon ground nutmeg', '1/2 cup coconut oil', '5 egg whites']","['Preheat the oven to 350 degrees F (175 degrees C). Lightly oil a 9x9-inch oven-safe glass baking dish.', ""Combine almonds, sliced almonds, cashews, pistachios, and pumpkin seeds in the bowl of a food processor. Pulse on the 'coarse' setting until coarsely chopped. Pour 1/2 the mixture into a large bowl. Continue blending the remaining mixture in the food processor until nuts are finely chopped and have a flour-like consistency. Add to the bowl. Fold in dates, coconut, salt, cinnamon, and nutmeg and stir to combine."", 'Add coconut oil and egg whites to the nut mixture in the bowl, folding until well incorporated. Transfer mixture to the prepared baking dish.', 'Bake in the preheated oven until set, about 40 minutes.', 'Remove and let cool to room temperature, about 30 minutes. Cut into bar shapes and wrap in aluminum foil for easy transport.']"
21,uncertain,214659/cookies-and-peppermint-ice-cream-cake/,Cookies and Peppermint Ice Cream Cake,"[]",0,4.76923084259033,https://images.media-allrecipes.com/userphotos/560x315/6198793.jpg,"['30 cream-filled chocolate sandwich cookies (such as Oreo®)', '1/2 cup butter', ""2 cups confectioners' sugar"", '9 tablespoons unsweetened cocoa powder', '1 tablespoon vegetable oil', '2 eggs, beaten', '1/2 gallon peppermint ice cream']","['In batches of 5 cookies at a time, pulverize the cookies in a blender until fine. Set the last batch of 5 crumbled cookies aside; place the remaining cookies into the bottom of a 9x13-inch pan, and smooth into a crust.', ""Melt butter in a saucepan over low heat, and stir in the confectioners' sugar, cocoa, and vegetable oil into a smooth mixture. Pour in the beaten eggs, and whisk constantly until the mixture is hot (do not boil) and thickened to a fudgy consistency, about 5 minutes. Pour the thickened fudge over the crushed cookie crust, smooth into a layer, and freeze cake at least 30 minutes."", 'Set the peppermint ice cream out to soften for about 10 minutes. Cut the softened ice cream into slices, and place the ice cream slices over the fudge filling. Smooth the ice cream out into an even layer, and sprinkle reserved crushed cookies on top for garnish. Freeze the dessert for 1 to 2 hours before serving.']"

22,main,241922/lemon-poppyseed-muffins-with-lemon-glaze/,Lemon Poppyseed Muffins with Lemon Glaze,"[23, 24, 25, 26, 27, 28, 29, 30, 31, 32]",28,4.2857141494751,https://images.media-allrecipes.com/userphotos/560x315/2209362.jpg,"['1 3/4 cups all-purpose flour', '3/4 cup white sugar', '2 lemons, zested and juiced', '2 tablespoons poppy seeds', '2 2/3 teaspoons baking powder', '1/2 teaspoon salt', '1 cup buttermilk', '1/3 cup sour cream', '1/3 cup vegetable oil', '1 egg', ""1 cup confectioners' sugar""]","['Preheat oven to 350 degrees F (175 degrees C). Line 12 muffin cups with paper muffin liners.', 'Whisk flour, white sugar, lemon zest, poppy seeds, baking powder, and salt together in a bowl. Beat buttermilk, sour cream, vegetable oil, and egg together in another bowl. Pour buttermilk mixture into flour mixture and stir until batter is just combined. Pour batter into the prepared muffin cups.', 'Bake in the preheated oven until a toothpick inserted into the center of a muffin comes out clean, about 20 minutes. Cool for 10 minutes.', ""While muffins are cooling, whisk confectioners' sugar and lemon juice together in a bowl until glaze is smooth. Drizzle glaze over muffins.""]"
23,certain,231474/quick-lemon-poppy-seed-muffins/,Quick Lemon Poppy Seed Muffins,"[]",22,4.45454549789429,https://images.media-allrecipes.com/userphotos/560x315/974052.jpg,"['1 (1 pound) flank steak', '5 teaspoons white sugar, divided', 'kosher salt to taste', 'freshly ground black pepper to taste', '1 tablespoon cornstarch', '3 tablespoons vegetable oil, divided', '2 large eggs, beaten', '1 onion, diced', '2 cloves garlic, minced', '1 teaspoon grated ginger', '1 cup frozen peas, thawed', '2 tablespoons water', '3 cups cooked white rice', '3 tablespoons soy sauce', '1 teaspoon white vinegar', '1 teaspoon sesame oil']","['Pat flank steak dry with a paper towel. Cut into bite-sized pieces and transfer to a medium bowl. Season with 1 teaspoon sugar, salt, and pepper. Add cornstarch and toss until well coated.', 'Heat 1 teaspoon oil a wok or large skillet over medium-high heat. Add eggs and scramble using a rubber spatula, 3 to 5 minutes. Remove eggs to a dish.', 'Add 1 teaspoon oil and 1/2 of the meat to the wok. Increase heat to high and cook until browned on all sides and cooked through, 3 to 5 minutes. Remove to a plate. Add 1 teaspoon oil and repeat with remaining meat.', 'Add remaining 2 tablespoons oil to the wok and reduce heat to medium-low. Add onion, garlic, and ginger; cook until onions begin to soften, 2 to 3 minutes. Add peas and water; cook until peas are tender, 2 to 3 minutes. Add cooked rice, breaking it up with a spatula, and cook until heated through, 2 to 3 minutes. Stir in soy sauce, remaining 4 teaspoons sugar, vinegar, and sesame oil. Add meat and scrambled eggs, toss together and cook until heated through, about 3 minutes. Serve immediately.']"
