id,type,recipe,title,most_similar,ratings,stars,image,ingredients,directions
23,certain,baked-teriyaki-chicken/,Baked Teriyaki Chicken,"[]",7416,4.64967632293701,https://images.media-allrecipes.com/userphotos/560x315/4530047.jpg,"['1 stalk celery, sliced', '3 tablespoons olive oil', '1 onion, quartered', '1 clove garlic, chopped', '1 head cauliflower, cut into small florets', '1 (28 ounce) can whole peeled tomatoes, drained and mashed', '1 teaspoon dried sage', 'salt and ground black pepper to taste', '2 tablespoons chicken broth, or as needed (optional)', '1 (8 ounce) package linguine pasta', '1 cup grated Parmesan cheese']","['Put a celery slice in a deep skillet with a cover; add olive oil. Heat olive oil over medium-high heat until celery slice is sizzling, 3 to 5 minutes. Add remaining celery, onion, and garlic to olive oil; turn heat to medium. Cook and stir onion mixture until slightly tender, about 5 minutes.', 'Mix cauliflower, tomatoes, sage, salt, and pepper into onion mixture; cook and stir over medium-high heat until bubbling, about 5 minutes. Cover skillet with lid, reduce heat to low, and cook until a knife slides easily into cauliflower, about 15 minutes. Add chicken broth if tomato and cauliflower sauce begins to burn.', 'Bring a large pot of lightly salted water to a boil. Cook linguine at a boil until tender yet firm to the bite, about 11 minutes; drain and transfer to a serving bowl.', 'Pour tomato and cauliflower sauce over pasta; add Parmesan cheese. Toss to coat.']"
24,certain,l-recipe/63700524/baked-teriyaki-chicken/,Baked Teriyaki Chicken,"[]",0,0,https://images.media-allrecipes.com/images/79590.png,"['1 cup cold cooked sushi rice', '1 sheet nori (dry seaweed)', '1 tablespoon masago', '1/2 deep-fried soft-shell crab', '3 slices red bell pepper', '2 leaves leaf lettuce', '1/2 tablespoon okonomiyaki sauce', '1/2 avocado, thinly sliced']","['Spread rice on 1/2 of the sheet of nori. Sprinkle masago over the rice. Flip nori over and place on a sushi rolling mat.', 'Add crab, bell pepper, lettuce, and okonomiyaki sauce. Roll nori over ingredients into a roll. Place avocado slices on top of the sushi roll, then cover with plastic wrap and press on by rolling in the sushi mat again. Slice the roll into about 6 pieces and remove the plastic wrap. Place sushi on a plate and drizzle with additional okonomiyaki sauce.']"
25,certain,l-recipe/63613459/teriyaki-sauce/,Teriyaki Sauce,"[]",0,0,https://images.media-allrecipes.com/images/79590.png,"['cooking spray', '1 (10.75 ounce) can condensed cream of chicken soup', '1 (8 ounce) container fat-free sour cream', '1 (4.5 ounce) can chopped green chilies', '1/2 cup low-fat milk', '2 1/2 cups cooked, shredded chicken breast meat', '8 (6 inch) yellow corn tortillas, torn into bite-size pieces', '1 teaspoon taco seasoning mix, or more to taste', '1 large tomato, chopped', '1 1/2 cups shredded Mexican-style cheese blend, divided']","['Preheat oven to 350 degrees F (175 degrees C). Spray a 9x13-inch baking dish with cooking spray.', 'Stir condensed soup, sour cream, green chilies, and milk together in a large bowl. Add chicken, tortilla pieces, and taco seasoning; stir. Mix tomato and 1 cup Mexican-style cheese blend into chicken mixture.', 'Spread chicken mixture out into the prepared baking dish and cover the dish with aluminum foil.', 'Bake casserole in the preheated oven for 40 minutes. Discard aluminum foil. Sprinkle remaining cheese over the top of the casserole and continue baking until cheese melts and casserole is bubbling, 5 to 10 minutes more. Let rest for 5 minutes.']"
26,certain,220868/pressure-cooker-teriyaki-chicken/,Pressure Cooker Teriyaki Chicken,"[]",154,4.49,https://images.media-allrecipes.com/userphotos/3804857.jpg,"['¾ cup brown sugar', '¾ cup reduced-sodium soy sauce', '¼ cup cider vinegar', '2 tablespoons ground ginger', '2 tablespoons garlic powder', '1 teaspoon ground black pepper', '1 (20 ounce) can crushed pineapple', '1 cup chicken stock', '3 pounds boneless, skinless chicken thighs', '2 tablespoons cornstarch (optional)', '2 tablespoons cold water (optional)']","['Combine brown sugar, soy sauce, cider vinegar, ginger, garlic powder, pepper, crushed pineapple and juice, and chicken stock in a bowl and stir until the brown sugar is dissolved.', 'Place chicken thighs in the pressure cooker and pour in the sauce. Stir gently to coat. Bring the pressure cooker up to high pressure over high heat, then reduce the heat to low, maintaining high pressure. Cook for 20 minutes.', 'Stir cornstarch into cold water and set aside.', 'Reduce the pressure using the rapid-release method. Use a slotted spoon to transfer the chicken to a serving dish; cover with foil and set aside. Whisk the cornstarch mixture into the sauce, bring the mixture to a boil, and cook, stirring frequently, until the sauce has thickened, about 3 minutes. Serve the chicken topped with the teriyaki sauce.']"
27,certain,220116/chinese-sweet-and-sour-chicken/,Chinese Sweet and Sour Chicken,"[]",34,4.55882358551025,https://images.media-allrecipes.com/userphotos/560x315/809181.jpg,"['2 mid sized beets', '1/2 cup of pitted prunes(washed and chopped)', '2 tablespoons of olive oil', '1 clove of garlic (optional)', '1 pinch of salt', '1 pinch of pepper', 'leaves of parsley (optional)']","['Wash and set to boil the beets. Boil the beets for an hour or for as long as it will take the to be cooked (soft inside, check with the knife)', 'Wash the prunes and finely chop them . If you don’t like the prunes you can use walnuts or you can use both it will be even more delicious.', 'Whet the beets are cooked, drain the water, let them cool down and then peel and shred the beets.', 'Mix the beet with prunes and add the pressed garlic (optional). Season the salad and add the olive oil. Mix everything very well.', 'Serve with the leaves of parsley (optional) to enhance the taste!', 'Enjoy!', '***Tip from Helen*** If you want the salad to be more creamy and you aren’t vegan or vegetarian – then you can add some mayo instead of olive oil!']"
28,uncertain,222821/teriyaki-tuna-steaks/,Teriyaki Tuna Steaks,"[]",9,3,https://images.media-allrecipes.com/userphotos/560x315/2285234.jpg,"['1/4 fresh pineapple, peeled', '1 Golden Delicious apple, quartered', '1 small beet, top and bottom trimmed', '1/4 cup fresh spinach, or to taste', '1/4 cup mixed berries, or to taste', '1/2 banana', '1/2 avocado, peeled', '3 ice cubes']","['Process pineapple, apple, beet, and spinach through a juicer.', 'Blend juice, berries, banana, avocado, and ice cubes in a blender until smooth.']"
29,uncertain,246373/spicy-teriyaki-spamr-and-pineapple-on-a-hawaiian-roll/,Spicy Teriyaki Spam® and Pineapple on a Hawaiian Roll,"[]",0,5,https://images.media-allrecipes.com/userphotos/560x315/3624309.jpg,"['8 (6 inch) flour tortillas', '1 pound skinless, boneless chicken breast halves - cut into strips', '2 small red bell peppers, cut into strips', '2 teaspoons Jamaican jerk seasoning', '1/8 teaspoon ground black pepper', '4 slices canned pineapple, chopped', '1 tablespoon vegetable oil', 'chopped fresh cilantro', 'lime wedges']","['Preheat an oven to 350 degrees F (175 degrees C). Wrap the tortillas in aluminum foil and heat in the oven.', 'Combine the chicken, bell pepper, jerk seasoning, and pepper in a large bowl, set aside. Heat a large skillet over medium-high heat, and coat with cooking spray. Add the pineapple and cook until brown, about 4 to 6 minutes. Remove the pineapple from the pan and set aside.', 'Return the skillet to the stove and heat the vegetable oil. Add the chicken and peppers; cook and stir until the chicken is no longer pink, about 6 minutes. Stir in the cooked pineapple. Serve in the warmed tortillas and garnish with cilantro and a squeeze of lime.']"
30,uncertain,262228/instant-potr-teriyaki-chicken-breast/,Instant Pot® Teriyaki Chicken Breast,"[]",0,4.66666650772095,https://images.media-allrecipes.com/userphotos/560x315/5069492.jpg,"['8 potatoes, peeled and cubed', '1/2 cup bottled Caesar salad dressing', '2 carrots, coarsely grated', '6 green onions, sliced', '1 Hatch chile pepper, seeded and diced', '1/2 teaspoon salt', '1/4 teaspoon ground black pepper']","['Place potatoes in a 2-quart microwave-safe casserole dish. Microwave on high, stirring halfway through, until tender, about 9 minutes. Drain any liquid that may have accumulated.', 'Mix Caesar dressing, carrots, green onions, Hatch chile pepper, salt, and pepper together in a large bowl. Stir in potatoes.']"
31,uncertain,l-recipe/63705046/teriyaki-beef-with-ginger/,Teriyaki Beef with Ginger,"[]",0,5,https://images.media-allrecipes.com/userphotos/250x250/2369741.jpg,"['2 cups hulled strawberries', '3 tablespoons lime juice', '1 tablespoon honey', '1 tablespoon tequila']","['Blend strawberries, lime juice, honey, and tequila in a blender until smooth.']"
32,uncertain,274393/pineapple-chicken-teriyaki/,Pineapple Chicken Teriyaki,"[]",1,3,https://images.media-allrecipes.com/userphotos/6844997.jpg,"['1 cup water', '¼ cup soy sauce', '5 tablespoons soy sauce', '1 tablespoon dark molasses', '½ tablespoon fresh ground ginger', '1 teaspoon minced garlic', '¼ cup water', '2 tablespoons cornstarch', '3 tablespoons vegetable oil', '1 tablespoon minced garlic', '1 teaspoon red pepper flakes, or to taste', '3 large chicken breasts, cut into bite-sized pieces', '1 (16 ounce) package frozen oriental-style vegetables', '1 (8 ounce) can sliced water chestnuts', '1 (8 ounce) can pineapple tidbits in juice, drained and juice reserved', '1 tablespoon cornstarch', '⅛ teaspoon sesame oil']","['Combine water, 1/4 cup plus 5 tablespoons soy sauce, molasses, ginger, and garlic in a saucepan and bring to a gentle boil, about 5 minutes. Combine water and cornstarch in a bowl; add to saucepan and stir until slightly thickened, about 3 minutes. Set sauce aside.', 'Heat oil in a large wok or frying pan over medium heat until sizzling. Add garlic, red pepper flakes, and chicken. Cook until chicken is no longer pink inside, 5 to 7 minutes. Transfer to a bowl and set aside. Add frozen vegetables and water chestnuts to wok and cook until heated through, about 10 minutes. Add drained pineapple and prepared sauce; bring mixture to a simmer, about 5 minutes.', 'Meanwhile, combine reserved pineapple juice and cornstarch in a small bowl. Add mixture to wok and stir until slightly thickened, about 1 minute. Remove from heat and quickly stir in sesame oil.']"

33,main,23600/worlds-best-lasagna/,World's Best Lasagna,"[34, 35, 36, 37, 38, 39, 40, 41, 42, 43]",18056,4.79541444778442,https://images.media-allrecipes.com/userphotos/560x315/3359675.jpg,"['1 pound sweet Italian sausage', '3/4 pound lean ground beef', '1/2 cup minced onion', '2 cloves garlic, crushed', '1 (28 ounce) can crushed tomatoes', '2 (6 ounce) cans tomato paste', '2 (6.5 ounce) cans canned tomato sauce', '1/2 cup water', '2 tablespoons white sugar', '1 1/2 teaspoons dried basil leaves', '1/2 teaspoon fennel seeds', '1 teaspoon Italian seasoning', '1 1/2 teaspoons salt, divided, or to taste', '1/4 teaspoon ground black pepper', '4 tablespoons chopped fresh parsley', '12 lasagna noodles', '16 ounces ricotta cheese', '1 egg', '3/4 pound mozzarella cheese, sliced', '3/4 cup grated Parmesan cheese']","['In a Dutch oven, cook sausage, ground beef, onion, and garlic over medium heat until well browned. Stir in crushed tomatoes, tomato paste, tomato sauce, and water. Season with sugar, basil, fennel seeds, Italian seasoning, 1 teaspoon salt, pepper, and 2 tablespoons parsley. Simmer, covered, for about 1 1/2 hours, stirring occasionally.', 'Bring a large pot of lightly salted water to a boil. Cook lasagna noodles in boiling water for 8 to 10 minutes. Drain noodles, and rinse with cold water.  In a mixing bowl, combine ricotta cheese with egg, remaining parsley, and 1/2 teaspoon salt.', 'Preheat oven to 375  degrees F (190 degrees C).', 'To assemble, spread 1 1/2 cups of meat sauce in the bottom of a 9x13 inch baking dish.  Arrange 6 noodles lengthwise over meat sauce. Spread with one half of the ricotta cheese mixture. Top with a third of mozzarella cheese slices. Spoon 1 1/2 cups meat sauce over mozzarella, and sprinkle with 1/4 cup Parmesan cheese.  Repeat layers, and top with remaining mozzarella and Parmesan cheese. Cover with foil: to prevent sticking, either spray foil with cooking spray, or make sure the foil does not touch the cheese.', 'Bake in preheated oven for 25 minutes. Remove foil, and bake an additional 25 minutes. Cool for 15 minutes before serving.']"
34,certain,l-recipe/62687952/worlds-best-lasagna-tweaked/,World's Best Lasagna-Tweaked,"[]",0,5,https://images.media-allrecipes.com/userphotos/250x250/604213.jpg,"['1 quart vinegar', '3 quarts water', '1 cup salt', '7 quarts small cucumbers', 'sprays of fresh dill', 'cloves of garlic (optional)']","['pack 7- 1 quart jars of cucumbers and a spray of dill in each jar.', 'Mix brine and bring to boil, pour this over cucumbers and seal.']"
35,certain,222087/healthier-worlds-best-lasagna/,Healthier World's Best Lasagna,"[]",67,4.61194038391113,https://images.media-allrecipes.com/userphotos/560x315/879964.jpg,"['4 cups sugar', '1 cup white vinegar', '1 cup water', '2 tablespoons whole cloves', '4 pounds fresh clingstone peaches, blanched and peeled', '5 (3 inch) cinnamon sticks']","['Combine the sugar, vinegar and water in a large pot, and bring to a boil. Boil for 5 minutes. Press one or two cloves into each peach, and place into the boiling syrup. Boil for 20 minutes, or until peaches are tender.', 'Spoon peaches into sterile jars and top with liquid to 1/2 inch from the rim. Put one cinnamon stick into each jar. Wipe the rims with a clean dry cloth, and seal with lids and rings. Process in a hot water bath for 10 minutes to seal, or consult times recommended by your local extension.']"
36,certain,117110/italian-sausage-lasagna/,Italian Sausage Lasagna,"[]",83,4.66265058517456,https://images.media-allrecipes.com/userphotos/250x250/987982.jpg,"['3 skinless, boneless chicken breasts, cut into 1 1/2-inch pieces', '1 cup lemon juice', '4 eggs', '1 stick butter', '1 medium yellow onion, chopped', '1 tablespoon diced fresh ginger', '2 teaspoons diced garlic', '2 cups water', '1 cup basmati rice', '8 teaspoons paprika', '8 teaspoons berbere spice blend, or to taste', '1 (15 ounce) can diced fire-roasted tomatoes, or more to taste', '2 cups chicken broth, or more as needed', 'salt and ground black pepper to taste']","['Combine chicken and lemon juice in a bowl and marinate until flavors meld, at least 15 minutes.', 'Place eggs in a saucepan and cover with water. Bring to a boil, remove from heat, and let eggs stand in hot water for 15 minutes. Remove eggs from hot water, cool under cold running water, and peel.', 'Melt butter over medium heat in a pot. Add onion, ginger, and garlic to the hot butter and cook until onion is soft, 5 to 7 minutes.', 'Bring water and rice to a boil in a saucepan. Reduce heat to medium-low, cover, and simmer until rice is tender and water has been absorbed, 25 to 30 minutes. Keep warm.', 'While rice cooks, stir paprika and berbere seasoning into the onion mixture, adjusting to taste. Add chicken to the pot and brown, 5 to 7 minutes per side. Pour in tomatoes and stir to combine. Pour in enough chicken broth to thin mixture out to stew consistency. Reduce heat and let simmer until chicken is no longer pink in the center, 20 to 30 minutes, adding hard-boiled eggs when stew has about 10 minutes of cooking time left.', 'Pierce eggs using a fork to allow sauce to seep in. Continue to simmer 10 minutes more. Season with salt and pepper and serve over cooked basmati rice.']"
37,certain,232337/kims-lasagna/,Kim's Lasagna,"[]",92,4.72826099395752,https://images.media-allrecipes.com/userphotos/560x315/1113127.jpg,"['2 tsp. extra virgin olive oil', '2 tbsp. red wine vinegar', '1 tsp. chopped fresh or 1/2 tsp. dried oregano', '1 tbsp. minced shallots', '1/2 tsp. salt', '1/4 tsp. freshly ground black pepper']",['Whisk all the ingredients together until blended.']
38,certain,278027/worlds-best-now-vegetarian-lasagna/,World's Best (Now Vegetarian!) Lasagna,"[]",0,0,https://images.media-allrecipes.com/userphotos/560x315/7615008.jpg,"['1 tablespoon olive oil', '1/2 cup minced onion', '2 cloves garlic, crushed', '8 ounces plant-based hot Italian-style sausage (such as Beyond Meat®), chopped', '6 ounces cooked and crumbled ground meat substitute (such as BOCA)', '1 (15 ounce) can crushed tomatoes', '1 (8 ounce) can tomato sauce', '1 (6 ounce) can tomato paste', '1/4 cup water', '3 tablespoons chopped fresh parsley, divided', '1 tablespoon white sugar', '3/4 teaspoon dried basil', '1 teaspoon salt, divided', '1/2 teaspoon Italian seasoning', '1/4 teaspoon fennel seeds', '1/8 teaspoon ground black pepper', '12 lasagna noodles', '1 egg, lightly beaten', '1 (15 ounce) container ricotta cheese', '12 ounces mozzarella cheese, sliced', '6 ounces grated Parmesan cheese', 'cooking spray']","['Heat oil in a Dutch oven over medium heat. Add onion and garlic; cook, stirring, until tender, 3 to 5 minutes. Stir in plant-based sausage, meat substitute crumbles, crushed tomatoes, tomato sauce, tomato paste, water, 1 tablespoon parsley, sugar, basil, 1/2 teaspoon salt, Italian seasoning, fennel seeds, and pepper. Bring to a boil; reduce heat and simmer, covered, stirring occasionally, until thickened, about 1 1/2 hours.', 'Bring a large pot of lightly salted water to a boil. Add lasagna noodles; cook 8 to 10 minutes. Drain and rinse noodles with cold water.', 'Preheat the oven to 375 degrees F (190 degrees C).', 'Meanwhile, stir together egg, ricotta, remaining 2 tablespoons parsley, and 1/2 teaspoon salt in a bowl.', 'To assemble lasagna, spread 1/3 of the sauce in a 9x13-inch baking dish. Arrange 6 noodles lengthwise over sauce. Spread with 1/2 of the ricotta mixture. Top with 1/3 of the mozzarella slices. Spoon 1/3 of the sauce over mozzarella and sprinkle with 1/4 cup Parmesan. Repeat layers and top with remaining mozzarella and Parmesan.', 'Bake, covered with cooking spray-coated foil, for 25 minutes. Remove foil and bake until hot and bubbly, about 25 minutes more. Cool for 15 minutes before slicing into 12 equal servings.']"
39,uncertain,244586/skillet-vegetable-lasagna/,Skillet Vegetable Lasagna,"[]",0,5,https://images.media-allrecipes.com/userphotos/560x315/2417878.jpg,"['4 tablespoons oil', '2 (2 pound) slabs baby back pork ribs', '1/2 teaspoon coarsely ground black pepper', '1 tablespoon ground chile powder', '4 1/2 tablespoons oil', '1 lg sweet onion or 1 teaspoon onion powder', '2 cups water', '1 cup ketchup', '1 cup white vinegar', '1 cup brown sugar', '4 tablespoons honey', '4 tablespoons Worcestershire sauce', '4 teaspoons salt', '1/2 teaspoon coarsely ground black pepper', '2 1/2 teaspoons liquid smoke flavoring', '4 teaspoons garlic powder or 3 garlic cloves', '1/2 teaspoon paprika', '2 tablespoon dark molasses', '1 tablespoon ground red chile powder']","['Preheat oven to 300 degree F (150 degrees C).', 'Cut each full rack of ribs in half, so that you have 4 half racks.  Sprinkle salt and pepper (more pepper than salt), and 1 tablespoon chili powder over meat. Wrap each half rack in aluminum foil. Bake for 2 1/2 hours.', 'Meanwhile, heat oil in a medium saucepan over medium heat. Cook and stir the onions and garlic in oil for 5 minutes. Stir in remaining ingredients. Season with 2 teaspoons salt, 1/4 teaspoon black pepper and 1/2 teaspoon ground chili powder. Bring mixture to a boil, then reduce heat. Simmer for 1 1/4 hours, uncovered, or until sauce thickens. Remove from heat, and set sauce aside.', 'Preheat an outdoor grill for high heat.', ""Remove the ribs from the oven, and let stand 10 minutes. Remove the racks from the foil, and place on the grill. Grill the ribs for 3 to 4 minutes on each side. Brush sauce on the ribs while they're grilling,  just before you serve them (adding it too early will burn it).""]"
40,uncertain,230272/mexican-lasagna-roll-ups/,Mexican Lasagna Roll Ups,"[]",0,4,https://images.media-allrecipes.com/userphotos/250x250/969022.jpg,"['1 (16 ounce) package lasagna noodles', '1 pound ground beef', '3/4 cup water', '1 (1 ounce) package hot taco seasoning mix', '1 (1 pound) package shredded Mexican cheese blend, or as needed', '1 (4 ounce) can sliced black olives', '1 (28 ounce) jar spaghetti sauce', '1 (8 ounce) jar taco sauce', '1/4 cup sour cream, or as desired']","['Bring a large pot of lightly salted water to a boil. Cook lasagna in the boiling water, stirring occasionally until cooked through but firm to the bite, about 8 minutes. Drain. Pat noodles dry with paper towels.', 'Cook and stir ground beef in a skillet over medium heat until browned and crumbly, about 10 minutes; drain excess grease. Stir water and taco seasoning mix into ground beef; cook and stir until thickened, about 2 minutes. Remove from heat and let meat cool.', 'Preheat oven to 400 degrees F (200 degrees C).', 'Lay a noodle flat on a work surface and place 1 tablespoon seasoned meat at one end of noodle; roll up just to enclose meat filling. Place 1 to 2 tablespoons shredded Mexican cheese blend onto noodle and roll just to cover cheese; sprinkle a few black olives on noodle and roll noodle to the end. Repeat with remaining noodles.', 'Pour enough spaghetti sauce into a 9x13-inch baking dish to cover the bottom; lay rolled noodles with seam sides down into dish over sauce. Spread taco sauce over noodles and spoon remaining spaghetti sauce over the top. Scatter any remaining meat sauce over the rolls and cover dish with aluminum foil.', 'Bake in the preheated oven until the sauce is bubbling and cheese has melted, about 40 minutes. Serve with sour cream on top.']"
41,uncertain,254345/polenta-lasagna-with-roasted-vegetables/,Polenta Lasagna with Roasted Vegetables,"[]",0,4.80000019073486,https://images.media-allrecipes.com/userphotos/560x315/3685289.jpg,"['2 teaspoons mayonnaise', '1/2 teaspoon Ranch dressing', '2 (1 inch thick) slices French bread', '1 slice smoked fontina cheese', '1 slice Havarti cheese', '1/4 cup jarred roasted red pepper, drained and chopped', '1 pepperoncini, sliced', '3 slices dill pickle (optional)', '1 leaf leaf lettuce']","['Stir together the mayonnaise and Ranch dressing, and spread onto one slice of bread. Place the fontina and Havarti cheese slices on the bread, then top with roasted red pepper, pepperoncini, pickle and lettuce. Top with the other slice of bread.']"
42,uncertain,107423/easy-dutch-oven-cheese-lasagna/,Easy Dutch Oven Cheese Lasagna,"[]",0,3.25,https://images.media-allrecipes.com/userphotos/560x315/4531158.jpg,"['1 whole skinless, boneless chicken breast, halved', '2 tablespoons Montreal steak seasoning', '2 tablespoons butter', '1/2 head iceberg lettuce, chopped', '1 tomato, chopped', '1/2 green bell pepper, cut into 1/4-inch cubes', '1/4 cup seeded and chopped jalapeno peppers, 3 tablespoon juice reserved', '2 tablespoons chopped green chile peppers', '1/4 cup drained canned corn kernels', '1/4 cup drained sliced black olives', '1/4 cup drained and rinsed black beans', '1/2 cup shredded Cheddar-Monterey Jack cheese blend', '1 cup ranch dressing', '1/2 teaspoon ground black pepper', '1/4 teaspoon garlic powder']","['Sprinkle chicken breast evenly with Montreal steak seasoning.', 'Melt butter in a frying pan over medium heat; cook chicken until no longer pink in the center and juices run clear, 5 to 10 minutes per side. Remove chicken from pan and cut into small pieces.', 'Mix lettuce, chicken, tomato, green bell pepper, jalapeno peppers, green chile peppers, corn, black olives, black beans, and Cheddar-Monterey Jack cheese blend in a large bowl; gently toss.', 'Whisk ranch dressing, reserved 3 tablespoons jalapeno juice, black pepper, and garlic powder together in a bowl; drizzle over salad. Toss to coat.']"
43,uncertain,236976/julies-cheesy-chicken-lasagna/,Julie's Cheesy Chicken Lasagna,"[]",0,3,https://images.media-allrecipes.com/userphotos/560x315/3841857.jpg,"['1 (32 ounce) package frozen French fries', '6 slices bacon', '4 ounces Cheddar cheese, shredded', '4 ounces Monterey Jack cheese, shredded', '2 jalapeno peppers, seeded and sliced']","['Preheat the oven to 425 degrees F (220 degrees C).', 'Arrange fries in a single layer on a rimmed baking sheet.', 'Bake in the preheated oven until light golden in color, 17 to 25 minutes.', 'Meanwhile, place bacon in a large skillet and cook over medium-high heat, turning occasionally, until evenly browned, about 10 minutes. Drain bacon slices on paper towels. Dice.', ""Remove fries from the oven. Preheat the oven's broiler. Lightly grease a 9x13-inch baking dish. Add a layer of fries, diced bacon, cheeses, and jalapeno peppers. Repeat layers until all ingredients are used."", 'Broil until cheese is melted, about 5 minutes.']"

44,main,83500/sausage-stuffed-jalapenos/,Sausage Stuffed Jalapenos,"[45, 46, 47, 48, 49, 50, 51, 52, 53, 54]",1005,4.80099487304688,https://images.media-allrecipes.com/userphotos/560x315/3289946.jpg,"['1 pound ground pork sausage', '1 (8 ounce) package cream cheese, softened', '1 cup shredded Parmesan cheese', '1 pound large fresh jalapeno peppers, halved lengthwise and seeded', '1 (8 ounce) bottle Ranch dressing (optional)']","['Preheat oven to 425 degrees F (220 degrees C).', 'Place sausage in a skillet over medium heat, and cook until evenly brown. Drain grease.', 'In a bowl, mix the sausage, cream cheese, and Parmesan cheese. Spoon about 1 tablespoon sausage mixture into each jalapeno half. Arrange stuffed halves in baking dishes.', 'Bake 20 minutes in the preheated oven, until bubbly and lightly browned. Serve with Ranch dressing.']"
