id,type,recipe,title,most_similar,ratings,stars,image,ingredients,directions
45,certain,176206/kickin-stuffed-peppers/,Kickin Stuffed Peppers,"[]",73,4.73972606658936,https://images.media-allrecipes.com/userphotos/560x315/6624111.jpg,"['3/4 cup finely minced mango', '1/4 cup seasoned rice vinegar', 'juice from one lime', '1/2 small Thai chile pepper, minced', '1 clove garlic, crushed', '1 teaspoon hot chile paste (such as sambal oelek)', '1 tablespoon chopped fresh cilantro']","['Stir mango, rice vinegar, lime juice, Thai chile pepper, garlic, and hot chile paste in a bowl until well combined. Cover and let rest 30 minutes. Stir in cilantro.']"
46,certain,58373/jalapenos-del-raton/,Jalapenos del Raton,"[]",23,4.60869550704956,https://images.media-allrecipes.com/userphotos/250x250/689325.jpg,"['4 cups soft white bread cubes', '3 eggs', '1 teaspoon ground cinnamon', '3 cups warm water', '1 (14 ounce) can EAGLE BRAND® Sweetened Condensed Milk (NOT evaporated milk)', '2 tablespoons butter or margarine, melted', '2 teaspoons vanilla extract', '1/2 teaspoon salt', 'Butter Rum Sauce:', '1/4 cup butter or margarine', '3/4 cup firmly packed brown sugar', '1/2 cup whipping cream', '1 teaspoon rum flavoring']","['Preheat oven to 350 degrees;.  Place bread cubes in buttered 9-inch square baking pan.', 'In large bowl, beat eggs and cinnamon; add remaining ingredients except Butter Rum Sauce.  Pour evenly over bread, moistening completely.', 'Bake 45 to 50 minutes or until knife inserted in center comes out clean.  Cool.  Serve warm with Butter Rum Sauce.  Refrigerate leftovers.', 'Butter Rum Sauce:  In saucepan, melt 1/4 cup butter or margarine; add 3/4 cup firmly packed brown sugar and 1/2 cup whipping cream.  Boil rapidly 8 to 10 minutes; add 1 teaspoon rum flavoring.  Serve warm.  (Makes about 1 cup)']"
47,certain,l-recipe/64026173/stuffed-peppers/,Stuffed Peppers,"[]",0,0,https://images.media-allrecipes.com/images/79590.png,"['2 Green Peppers', '1 Small Onion', '2 Sausage Links', '1.5 Oz Parmesan Cheese', '2 Oz. Cream Cheese', '1 Egg']","['Start by removing the skin of the sausage and cooking the sausage into crumbles', 'Cut off of the top of the peppers and remove the seeds', 'Chop up the tops of the peppers', 'Chop up onions and cook the peppers and onions', 'Chop up Parmesan cheese into small pieces', 'Combine the peppers, onions, cheese, sausage and cream cheese', 'Stuff the peppers with the stuffing and top with a quail egg', 'Cook for 20 minutes at 400 degrees']"
48,certain,264222/jalapeno-poppers-with-hillshire-farmr-smoked-sausage/,Jalapeno Poppers with Hillshire Farm® Smoked Sausage,"[]",0,4.58333349227905,https://images.media-allrecipes.com/userphotos/560x315/5348466.jpg,"['1/2 (8 ounce) package cream cheese, softened', '1 (14 ounce) package Hillshire Farm® Smoked Sausage', '2 fresh jalapeno peppers, halved lengthwise and seeded', '4 slices bacon', 'toothpicks']","['Cut cream cheese lengthwise into 4 pieces. Place on a plate and freeze 30 minutes.', 'Meanwhile, cut sausage crosswise into 4 portions. To create a pocket, cut each portion, lengthwise, three-fourths of the way through.', 'Place cream cheese pieces in the opening of each sausage portion. Then stuff each opening with half of a jalapeno.', 'Wrap a slice of uncooked bacon around each stuffed sausage and secure bacon with toothpicks as needed.', 'In a charcoal grill, arrange medium coals around the edge of the grill. Place a drip pan in the center of the grill. Place sausage, slit-side down, on a grill rack over the drip pan. Cover and grill 25 minutes or until sausage is browned and bacon is cooked through, turning (to slit-side up) halfway through grilling.', 'Let stand 10 minutes. Cut each sausage into 4 portions and serve with toothpicks as appetizers.']"
49,certain,139012/jalapeno-popper-spread/,Jalapeno Popper Spread,"[]",3758,4.74454498291016,https://images.media-allrecipes.com/userphotos/250x250/265544.jpg,"['2 (8 ounce) packages cream cheese, softened', '1 cup mayonnaise', '1 (4 ounce) can chopped green chilies, drained', '2 ounces canned diced jalapeno peppers, drained', '1 cup grated Parmesan cheese']","['Stir together cream cheese and mayonnaise in a large bowl until smooth. Stir in green chiles and jalapeno peppers. Pour mixture into a microwave safe serving dish, and sprinkle with Parmesan cheese.', 'Microwave on High until hot, about 3 minutes.']"
50,uncertain,234911/chorizo-stuffed-peppers-with-green-chile-ranchero-sauce/,Chorizo-Stuffed Peppers with Green Chile Ranchero Sauce,"[]",0,4.7142858505249,https://images.media-allrecipes.com/userphotos/560x315/7124167.jpg,"['2 tablespoons soy sauce', '2 tablespoons rice vinegar', '1 teaspoon finely grated ginger root', '2 1/2 cups frozen edamame in the pod']","['Whisk soy sauce, rice vinegar, and ginger together in a bowl; set dipping sauce aside.', 'Bring a large saucepan of water to a boil. Add edamame and boil until tender, about 5 minutes. Drain and rinse under cold water.', 'Serve pods with the sauce for dipping.']"
51,uncertain,239009/mexican-chicken-stuffed-peppers/,Mexican Chicken Stuffed Peppers,"[]",0,3.33333325386047,https://images.media-allrecipes.com/userphotos/560x315/1696928.jpg,"['1 tablespoon butter, or more to taste', '1 tablespoon olive oil', '1  butternut squash, peeled and cubed', '2  potatoes, peeled and cubed', '1  onion, diced', '1  carrot, peeled and chopped', '1 stalk celery, chopped', '1 clove garlic, minced', '1 quart chicken broth, or more as needed', '1  pear - peeled, cored, and sliced', '¼ teaspoon ground ginger', '⅛ teaspoon cayenne pepper', '⅛ teaspoon ground allspice', '⅛ teaspoon ground nutmeg', 'salt and ground black pepper to taste', '¼ cup heavy cream']","['Heat butter and olive oil in a large pot over medium heat. Add butternut squash, potatoes, onion, carrot, celery, and garlic; cook and stir until evenly coated and warmed through, about 10 minutes.', 'Pour enough chicken broth into the pot to cover the butternut squash mixture. Cook for 10 minutes. Add pear; simmer until potatoes are soft, about 30 minutes. Season with ginger, cayenne pepper, allspice, nutmeg, salt, and pepper.', 'Fill a blender halfway with soup. Cover and hold lid down with a potholder; pulse a few times before leaving on to blend. Pour into a pot. Repeat with remaining soup.', 'Stir heavy cream into the blended soup. Cook until heated through, 5 to 10 minutes.']"
52,uncertain,275820/keto-chorizo-stuffed-peppers/,Keto Chorizo-Stuffed Peppers,"[]",0,5,https://images.media-allrecipes.com/userphotos/560x315/7013275.jpg,"['1 pita bread round', '1 teaspoon olive oil', '3 tablespoons pizza sauce', '1/2 cup shredded mozzarella cheese', '1/4 cup sliced crimini mushrooms', '1/8 teaspoon garlic salt']","['Preheat grill for medium-high heat.', 'Watch Now', 'Spread one side of the pita with olive oil and pizza sauce. Top with cheese and mushrooms, and season with garlic salt.', 'Watch Now', 'Lightly oil grill grate. Place pita pizza on grill, cover, and cook until cheese completely melts, about 5 minutes.', 'Watch Now']"
53,uncertain,260144/tempeh-bean-stuffed-peppers/,Tempeh-Bean Stuffed Peppers,"[]",0,0,https://images.media-allrecipes.com/images/79591.png,"['1 (24 ounce) carton cottage cheese', '1 (12 ounce) container frozen whipped topping (such as Cool Whip®), thawed', '2 (3 ounce) packages orange-flavored gelatin (such as Jell-O®)', '1 (20 ounce) can crushed pineapple, drained', '1 (15 ounce) can mandarin oranges, drained', '1 cup miniature marshmallows']","['Stir cottage cheese and whipped topping together in a bowl; sprinkle gelatin over the top and mix thoroughly. Stir pineapple, oranges, and marshmallows into cottage cheese mixture. Cover the bowl with plastic wrap and refrigerate until chilled, at least 1 hour.']"
54,uncertain,223019/millet-and-beef-stuffed-peppers/,Millet and Beef Stuffed Peppers,"[]",0,5,https://images.media-allrecipes.com/userphotos/560x315/6447669.jpg,"['1/2 cup millet', '2 cups water', '2 cubes vegetable bouillon', '2 tablespoons olive oil', '1 onion, chopped', '2 garlic cloves, crushed', '1/2 pound ground beef', '3 tablespoons tomato paste', '1 teaspoon paprika', '1 teaspoon cumin', '1/4 teaspoon cayenne pepper', '1/4 teaspoon ground black pepper', '1 tablespoon chopped fresh cilantro', '1/4 cup chopped feta cheese', '4 large red bell peppers, tops removed and set aside and seeds removed']","['Preheat an oven to 450 degrees F (230 degrees C). Grease a baking dish.', 'Combine millet, water, and vegetable bouillon in a saucepan; bring to a boil. Reduce heat to low, cover, and simmer until water is absorbed, about 15 minutes.', 'Heat olive oil in a skillet over medium heat; cook and stir onion and garlic until onion is tender, 8 to 10 minutes. Add ground beef and cook until beef is crumbly and browned, 8 to 10 minutes. Stir in tomato paste, paprika, cumin, cayenne pepper, and black pepper; stir and simmer to combine flavors, about 5 minutes.', 'Mix cooked millet, cilantro, and feta cheese into ground beef mixture. Spoon mixture into red bell peppers; place in prepared baking dish.', 'Bake in the preheated oven until peppers are slightly tender, 15 to 20 minutes. Place the tops back on the peppers; bake until peppers are tender, 10 to 15 more minutes.']"